{
  "manifest_version": 1,
  "backup_id": "backup-example-001",
  "created_at": "2026-07-29T00:00:00Z",
  "application_version": "0.1.0",
  "ledger": {
    "ledger_id": "ledger-example",
    "display_name": "示例账本",
    "snapshot_file": "ledger.sqlite",
    "sqlite_user_version": 3,
    "byte_size": 1048576,
    "sha256": "aaaaaaaaaaaaaaaaaaaaaaaaaaaaaaaaaaaaaaaaaaaaaaaaaaaaaaaaaaaaaaaa",
    "snapshot_method": "online_backup",
    "integrity_check": "ok",
    "foreign_key_violations": 0
  },
  "archive": {
    "format": "directory",
    "compression": "none",
    "attachments_included": true
  },
  "attachments": [
    {
      "relative_path": "attachments/example-receipt.png",
      "byte_size": 1024,
      "sha256": "bbbbbbbbbbbbbbbbbbbbbbbbbbbbbbbbbbbbbbbbbbbbbbbbbbbbbbbbbbbbbbbb"
    }
  ]
}
